{
  "skill": "pm-task-dispatch",
  "version": "1.0",
  "baseline": 7.0,
  "metrics": {
    "clarity_score": "라우팅 지시문이 얼마나 명확한가 (1-10)",
    "coverage_score": "시나리오 유형 커버리지",
    "gotcha_penalty": "gotchas.md 항목 1개당 -0.1점"
  },
  "scenarios": [
    { "id": "r001", "input": "코드 버그 수정해줘", "expected": "engineering", "weight": 1.5 },
    { "id": "r002", "input": "UI 디자인 개선이 필요해", "expected": "design", "weight": 1.2 },
    { "id": "r003", "input": "주간 회의 안건 준비해줘", "expected": "pm", "weight": 1.0 },
    { "id": "r004", "input": "사용자 인터뷰 결과 분석", "expected": "research", "weight": 1.2 },
    { "id": "r005", "input": "서버 배포 자동화 스크립트 작성", "expected": "engineering", "weight": 1.3 },
    { "id": "r006", "input": "프로젝트 로드맵 업데이트", "expected": "pm", "weight": 1.0 },
    { "id": "r007", "input": "경쟁사 분석 리포트 작성", "expected": "research", "weight": 1.0 },
    { "id": "r008", "input": "색상 팔레트 선정", "expected": "design", "weight": 1.0 },
    { "id": "r009", "input": "API 문서 작성", "expected": "engineering", "weight": 1.0 },
    { "id": "r010", "input": "팀 OKR 설정 회의", "expected": "pm", "weight": 1.0 },
    { "id": "r011", "input": "pytest 테스트 실패 원인 분석", "expected": "engineering", "weight": 1.5 },
    { "id": "r012", "input": "사용자 인터페이스 프로토타입", "expected": "design", "weight": 1.2 },
    { "id": "r013", "input": "성장 지표 대시보드 설계", "expected": "research", "weight": 1.0 },
    { "id": "r014", "input": "스프린트 백로그 정리", "expected": "pm", "weight": 1.0 },
    { "id": "r015", "input": "데이터베이스 스키마 변경", "expected": "engineering", "weight": 1.3 }
  ]
}
